{
  "$schema": "https://json-schema.org/draft/2020-12/schema",
  "$id": "https://clusterbuck.dev/contract/heartbeat-request.schema.json",
  "title": "HeartbeatRequest",
  "description": "Periodic worker heartbeat (protocols.md \u00a76): presence mode, installed vs loaded models, current queue subscriptions, and rolling stats. Also the poll point for updates.",
  "type": "object",
  "additionalProperties": false,
  "required": [
    "mode"
  ],
  "properties": {
    "mode": {
      "type": "string",
      "enum": [
        "active",
        "away",
        "paused"
      ]
    },
    "installed": {
      "type": "array",
      "items": {
        "type": "string"
      },
      "default": []
    },
    "loaded": {
      "type": "array",
      "items": {
        "type": "string"
      },
      "default": [],
      "description": "Warm right now \u2014 enables model-affinity routing."
    },
    "digests": {
      "type": "object",
      "description": "Optional artifact \u2192 content digest, where the model server exposes it. Ability is pinned to an artifact (ADR 15), so a changed digest means a NEW artifact whose score must be re-measured rather than inherited.",
      "additionalProperties": {
        "type": "string"
      }
    },
    "queues": {
      "type": "array",
      "items": {
        "type": "string"
      },
      "default": []
    },
    "stats": {
      "type": "object",
      "additionalProperties": true,
      "properties": {
        "jobs_done": {
          "type": "integer",
          "minimum": 0
        },
        "tps": {
          "type": "number",
          "minimum": 0
        },
        "load_s": {
          "type": "number",
          "minimum": 0,
          "description": "Median seconds to bring a model up from cold on this node, measured by subtracting the generation the node's own `tps` accounts for from a cold job's wall time. Storage speed times model size, which no probe of either alone can predict. Omitted until measured \u2014 a node that has never observed a cold start has no load time, and 0 would claim it warms instantly. Absent on model servers that cannot report which models are resident, since coldness must be proven rather than assumed."
        }
      }
    },
    "protocol_version": {
      "type": "integer",
      "minimum": 1,
      "description": "Queue-contract protocol version the worker speaks (skew gating, \u00a77)."
    },
    "action_result": {
      "type": [
        "object",
        "null"
      ],
      "description": "Outcome of the model-management action the previous heartbeat response issued. Closes the loop so the coordinator can mark the proposal applied or failed.",
      "additionalProperties": false,
      "required": [
        "proposal_id",
        "ok"
      ],
      "properties": {
        "proposal_id": {
          "type": "string",
          "minLength": 1
        },
        "ok": {
          "type": "boolean"
        },
        "error": {
          "type": [
            "string",
            "null"
          ]
        }
      }
    },
    "agent_version": {
      "type": "string",
      "description": "The worker's build-stamped release version (semver-ish, e.g. 0.7.0). The coordinator judges FITNESS from this, not just protocol compatibility: a version can speak the contract correctly and still carry bugs that produce wrong results."
    },
    "agent_flavour": {
      "type": "string",
      "description": "Which worker implementation this is, and therefore which release artifact it can actually EXECUTE: 'python' selects the single platform-independent py3-none-any artifact. Deliberately an open string rather than an enum so a new worker language needs no contract change. Absent \u21d2 'python', the only implementation there is. The coordinator FAILS CLOSED: a flavour it has no artifact mapping for is offered no update at all, because handing a worker a binary it cannot run \u2014 or worse, one it would install over its own entrypoint \u2014 is far worse than leaving it on an old version."
    }
  }
}
